{
  "$schema": "https://json-schema.org/draft/2020-12/schema",
  "$id": "https://expense-app.local/workflow/maintainer-policy.schema.json",
  "type": "object",
  "additionalProperties": false,
  "required": [
    "schemaVersion",
    "repository",
    "phase",
    "auditTagPrefix",
    "signatureNamespace",
    "maxTtlMinutes",
    "maxUses",
    "bootstrapEligiblePaths",
    "sealedImmutablePaths",
    "requiredChecks",
    "trustedSigners"
  ],
  "properties": {
    "schemaVersion": { "const": 1 },
    "repository": {
      "type": "object",
      "additionalProperties": false,
      "required": ["id", "origin"],
      "properties": {
        "id": { "type": "string", "pattern": "^github:[A-Za-z0-9_-]+$" },
        "origin": {
          "type": "string",
          "pattern": "^https://github\\.com/[A-Za-z0-9_.-]+/[A-Za-z0-9_.-]+\\.git$"
        }
      }
    },
    "phase": { "enum": ["bootstrap", "sealed"] },
    "auditTagPrefix": {
      "type": "string",
      "pattern": "^refs/tags/[a-z0-9][a-z0-9-]*/$"
    },
    "signatureNamespace": {
      "const": "expense-app.workflow.maintainer-grant.v1"
    },
    "maxTtlMinutes": { "const": 30 },
    "maxUses": { "const": 1 },
    "bootstrapEligiblePaths": { "$ref": "#/$defs/policyPaths" },
    "sealedImmutablePaths": { "$ref": "#/$defs/policyPaths" },
    "requiredChecks": {
      "type": "array",
      "minItems": 1,
      "uniqueItems": true,
      "items": {
        "type": "string",
        "pattern": "^[a-z0-9]+(?:-[a-z0-9]+)*$"
      }
    },
    "trustedSigners": {
      "type": "array",
      "minItems": 1,
      "items": {
        "type": "object",
        "additionalProperties": false,
        "required": ["identity", "publicKey", "fingerprint"],
        "properties": {
          "identity": {
            "type": "string",
            "pattern": "^[A-Za-z0-9][A-Za-z0-9._@+-]{0,127}$"
          },
          "publicKey": {
            "type": "string",
            "pattern": "^ssh-(?:ed25519|ed25519-sk|rsa|ecdsa-[^ ]+) [A-Za-z0-9+/]+={0,2}$"
          },
          "fingerprint": {
            "type": "string",
            "pattern": "^SHA256:[A-Za-z0-9+/]{20,}$"
          }
        }
      }
    }
  },
  "$defs": {
    "policyPaths": {
      "type": "array",
      "minItems": 1,
      "uniqueItems": true,
      "items": {
        "type": "string",
        "minLength": 1,
        "pattern": "^(?!/)(?![A-Za-z]:[\\\\/])(?!.*(?:^|/)\\.{1,2}(?:/|$))(?!.*//)(?!.*\\\\)(?!.*[?\\[\\]{}!])[^*]+(?:/\\*\\*)?$"
      }
    }
  }
}
